{
  "adapted": {
    "files": [
      {
        "path": "SKILL.md",
        "sha256": "eb6541a9650ac916a1d54a511412c9dfcf53557ad0ce043fa9786d81469c2749"
      }
    ],
    "path": "ports/citation-reference-audit/evidence/adapted"
  },
  "baseline": {
    "files": [
      {
        "path": "SKILL.md",
        "sha256": "c3e131c5747dc9c95eeceea3e7746c7fbb3eb5a312d02de61bb2e9cd61197395"
      }
    ],
    "path": "ports/citation-reference-audit/evidence/baseline"
  },
  "contract": {
    "name": "research-os/port",
    "version": "1.0.0"
  },
  "decision": "adapt",
  "decision_evidence": {
    "path": "ports/citation-reference-audit/evidence/decision.json",
    "sha256": "19600aee4241468bce29a49450426ac65f37f10bb73216f9db0aa315e6057247"
  },
  "decision_principal": "person:rolex",
  "evaluation": {
    "adapted": [
      {
        "detail": {
          "path": "ports/citation-reference-audit/evidence/evals/adapted-detail-1.json",
          "sha256": "7bc8c90199080c007d7f213c2a17a52ecbc21dfa460aa06b9f0605627ea892f9"
        },
        "evidence": {
          "path": "ports/citation-reference-audit/evidence/evals/adapted-1.json",
          "sha256": "70f0093c2d6b173423351ad088085f049178508dde74f2e324fd8345d3fa86a5"
        },
        "executed_at": "2026-09-06T12:25:27Z",
        "result": "pass",
        "run_id": "citation-reference-audit-adapted-1",
        "subject_sha256": "0c4f7447ffab26225401d5616629560a72a46c966575cf49774ac6eb59a274b6"
      },
      {
        "detail": {
          "path": "ports/citation-reference-audit/evidence/evals/adapted-detail-2.json",
          "sha256": "7bc8c90199080c007d7f213c2a17a52ecbc21dfa460aa06b9f0605627ea892f9"
        },
        "evidence": {
          "path": "ports/citation-reference-audit/evidence/evals/adapted-2.json",
          "sha256": "db6f875a1b2a5b1740206840db9a0e65acb711f5156038a41e1dda4d0e15e4b1"
        },
        "executed_at": "2026-09-06T12:25:28Z",
        "result": "pass",
        "run_id": "citation-reference-audit-adapted-2",
        "subject_sha256": "0c4f7447ffab26225401d5616629560a72a46c966575cf49774ac6eb59a274b6"
      }
    ],
    "baseline": [
      {
        "detail": {
          "path": "ports/citation-reference-audit/evidence/evals/baseline-detail-1.json",
          "sha256": "a16459fec47a2d7ac209cc8c3e6c0d25d7ef7670596cd7d65e9ba3daf6229fa6"
        },
        "evidence": {
          "path": "ports/citation-reference-audit/evidence/evals/baseline-1.json",
          "sha256": "69135412f2f9a8f6608b81a7dec5fc886797469403943842682f78b1412bf52e"
        },
        "executed_at": "2026-09-06T12:25:25Z",
        "result": "pass",
        "run_id": "citation-reference-audit-baseline-1",
        "subject_sha256": "e6f84312814cdb5e562f6762d87d4f6b230443d486312289c1ae8ace1fb3b5c1"
      },
      {
        "detail": {
          "path": "ports/citation-reference-audit/evidence/evals/baseline-detail-2.json",
          "sha256": "a16459fec47a2d7ac209cc8c3e6c0d25d7ef7670596cd7d65e9ba3daf6229fa6"
        },
        "evidence": {
          "path": "ports/citation-reference-audit/evidence/evals/baseline-2.json",
          "sha256": "e90ce23f82af19a6f2a5cea4f897b433cc443de65e8bf5fbbeefec322ac35d07"
        },
        "executed_at": "2026-09-06T12:25:26Z",
        "result": "pass",
        "run_id": "citation-reference-audit-baseline-2",
        "subject_sha256": "e6f84312814cdb5e562f6762d87d4f6b230443d486312289c1ae8ace1fb3b5c1"
      }
    ],
    "environment": {
      "path": "ports/citation-reference-audit/evidence/environment.txt",
      "sha256": "325a1ffa16ab9dee7534d99125d8407f1a92076e9d1b912ce09303a5a4f2abf8"
    },
    "harness": {
      "path": "ports/citation-reference-audit/evidence/harness.py",
      "sha256": "1417e8eeed9e6d13836a87907492140b38fe619cb0e53e6398c2dd2c3cee64d2"
    }
  },
  "id": "citation-reference-audit",
  "ledger": [
    {
      "action": "modify",
      "path": "SKILL.md",
      "reason": "Retain the research check while adding pinned inputs, bounded verdicts, user-control and no-automation boundaries"
    }
  ],
  "licensing": {
    "license": {
      "path": "ports/citation-reference-audit/evidence/LICENSE",
      "sha256": "e30cf5dd5f49b4f9b656590e23d782b4756c924a9f0ff0162b3e7b5d87006bf5"
    },
    "notice": {
      "reason": "The fixed upstream commit has no root NOTICE file; source attribution and modified-file notice are retained in this manifest and evidence.",
      "status": "not-required"
    },
    "spdx": "MIT",
    "status": "available"
  },
  "origin": "external",
  "original": {
    "behavior": {
      "path": "ports/citation-reference-audit/evidence/original-behavior.md",
      "sha256": "5a503d064344dc00518c4b9c1ff81889b371e1505a9a34167749bc95a37ce137"
    },
    "dependencies": []
  },
  "product": {
    "path": "ports/products/citation-reference-audit/SKILL.md",
    "sha256": "eb6541a9650ac916a1d54a511412c9dfcf53557ad0ce043fa9786d81469c2749"
  },
  "review": {
    "principal": "person:rolex",
    "rationale": "User explicitly approved this fixed source for read-only minimal adaptation. Review recommends only the bounded text discipline under Research OS controls; upstream runtime and commands were not executed.",
    "reviewed_at": "2026-09-06T12:40:00Z"
  },
  "snapshot": {
    "files": [
      {
        "path": "SKILL.md",
        "sha256": "c3e131c5747dc9c95eeceea3e7746c7fbb3eb5a312d02de61bb2e9cd61197395"
      }
    ],
    "path": "ports/citation-reference-audit/evidence/snapshot"
  },
  "source": {
    "commit": "2349f63ccfd7502aae95ec987b4d0a4c65d69c52",
    "evidence": {
      "path": "ports/citation-reference-audit/evidence/source.json",
      "sha256": "986a1c869451348ec83fd81f66c35f914e40112b504f4c759577a963424f0172"
    },
    "path": "skills/citation-audit/SKILL.md",
    "retrieved_at": "2026-09-06T12:24:48Z",
    "status": "available",
    "url": "https://github.com/wanshuiyin/Auto-claude-code-research-in-sleep.git"
  }
}
