{
  "adapted": {
    "files": [
      {
        "path": "SKILL.md",
        "sha256": "b262918226af3371e92c2677c7fd2a8786da59c27fb880455d231ce98527fdda"
      }
    ],
    "path": "ports/independent-proof-review/evidence/adapted"
  },
  "baseline": {
    "files": [
      {
        "path": "SKILL.md",
        "sha256": "533b0eed57171381cd5aabeb1c5cee7bbf23f46c36ad3483ddcc710c4cf5a8e1"
      }
    ],
    "path": "ports/independent-proof-review/evidence/baseline"
  },
  "contract": {
    "name": "research-os/port",
    "version": "1.0.0"
  },
  "decision": "adapt",
  "decision_evidence": {
    "path": "ports/independent-proof-review/evidence/decision.json",
    "sha256": "5dfbf080dc0dda3f325b36c0650201e4462f750b7b72f57d1bafd5f97ffe31a5"
  },
  "decision_principal": "person:rolex",
  "evaluation": {
    "adapted": [
      {
        "detail": {
          "path": "ports/independent-proof-review/evidence/evals/adapted-detail-1.json",
          "sha256": "187f293e496b17299c6a2a016322d47a06e8d302cf0ab33003a6808d9ff264cc"
        },
        "evidence": {
          "path": "ports/independent-proof-review/evidence/evals/adapted-1.json",
          "sha256": "af69a63b7abee53404f816a0c98dbc8f44d4df40095622224937d817fedc2d95"
        },
        "executed_at": "2026-09-06T12:25:19Z",
        "result": "pass",
        "run_id": "independent-proof-review-adapted-1",
        "subject_sha256": "8c0e70ffdaad77006b5c3316877b812fd5a7f1ee4430067040ef65e4277f18fb"
      },
      {
        "detail": {
          "path": "ports/independent-proof-review/evidence/evals/adapted-detail-2.json",
          "sha256": "187f293e496b17299c6a2a016322d47a06e8d302cf0ab33003a6808d9ff264cc"
        },
        "evidence": {
          "path": "ports/independent-proof-review/evidence/evals/adapted-2.json",
          "sha256": "3f58d7403eff68e2dfb5fd9d9ff3437437bf8345f45e95be2050a2f15e026c30"
        },
        "executed_at": "2026-09-06T12:25:20Z",
        "result": "pass",
        "run_id": "independent-proof-review-adapted-2",
        "subject_sha256": "8c0e70ffdaad77006b5c3316877b812fd5a7f1ee4430067040ef65e4277f18fb"
      }
    ],
    "baseline": [
      {
        "detail": {
          "path": "ports/independent-proof-review/evidence/evals/baseline-detail-1.json",
          "sha256": "b14426d98d716c88aa0c18cc7ee24b4316d37c590a3a0c4625014055d645325a"
        },
        "evidence": {
          "path": "ports/independent-proof-review/evidence/evals/baseline-1.json",
          "sha256": "d4f2b050beeb20b47d70acec55bfa870a089c909490a93622967196c4da0568a"
        },
        "executed_at": "2026-09-06T12:25:17Z",
        "result": "pass",
        "run_id": "independent-proof-review-baseline-1",
        "subject_sha256": "274820d8b171aaa15ec4a3abb1c227aa7607ef11aeb1aff9960a94ac9f356b31"
      },
      {
        "detail": {
          "path": "ports/independent-proof-review/evidence/evals/baseline-detail-2.json",
          "sha256": "b14426d98d716c88aa0c18cc7ee24b4316d37c590a3a0c4625014055d645325a"
        },
        "evidence": {
          "path": "ports/independent-proof-review/evidence/evals/baseline-2.json",
          "sha256": "6a13d60f75041a346472700eee77a2cbd8f35cdf43c089c5fa2430f038b1110d"
        },
        "executed_at": "2026-09-06T12:25:18Z",
        "result": "pass",
        "run_id": "independent-proof-review-baseline-2",
        "subject_sha256": "274820d8b171aaa15ec4a3abb1c227aa7607ef11aeb1aff9960a94ac9f356b31"
      }
    ],
    "environment": {
      "path": "ports/independent-proof-review/evidence/environment.txt",
      "sha256": "325a1ffa16ab9dee7534d99125d8407f1a92076e9d1b912ce09303a5a4f2abf8"
    },
    "harness": {
      "path": "ports/independent-proof-review/evidence/harness.py",
      "sha256": "1417e8eeed9e6d13836a87907492140b38fe619cb0e53e6398c2dd2c3cee64d2"
    }
  },
  "id": "independent-proof-review",
  "ledger": [
    {
      "action": "modify",
      "path": "SKILL.md",
      "reason": "Retain the research check while adding pinned inputs, bounded verdicts, user-control and no-automation boundaries"
    }
  ],
  "licensing": {
    "license": {
      "path": "ports/independent-proof-review/evidence/LICENSE",
      "sha256": "e30cf5dd5f49b4f9b656590e23d782b4756c924a9f0ff0162b3e7b5d87006bf5"
    },
    "notice": {
      "reason": "The fixed upstream commit has no root NOTICE file; source attribution and modified-file notice are retained in this manifest and evidence.",
      "status": "not-required"
    },
    "spdx": "MIT",
    "status": "available"
  },
  "origin": "external",
  "original": {
    "behavior": {
      "path": "ports/independent-proof-review/evidence/original-behavior.md",
      "sha256": "b84101a6729ae39d15d43d88ac48ab021b9e34765bf7a3cee65f41bef5eb80ca"
    },
    "dependencies": []
  },
  "product": {
    "path": "ports/products/independent-proof-review/SKILL.md",
    "sha256": "b262918226af3371e92c2677c7fd2a8786da59c27fb880455d231ce98527fdda"
  },
  "review": {
    "principal": "person:rolex",
    "rationale": "User explicitly approved this fixed source for read-only minimal adaptation. Review recommends only the bounded text discipline under Research OS controls; upstream runtime and commands were not executed.",
    "reviewed_at": "2026-09-06T12:40:00Z"
  },
  "snapshot": {
    "files": [
      {
        "path": "SKILL.md",
        "sha256": "533b0eed57171381cd5aabeb1c5cee7bbf23f46c36ad3483ddcc710c4cf5a8e1"
      }
    ],
    "path": "ports/independent-proof-review/evidence/snapshot"
  },
  "source": {
    "commit": "2349f63ccfd7502aae95ec987b4d0a4c65d69c52",
    "evidence": {
      "path": "ports/independent-proof-review/evidence/source.json",
      "sha256": "4c54df69f3654d9cf18008b6a8c52e647001269bf96ea7344b2fbbbe23980ad9"
    },
    "path": "skills/proof-checker/SKILL.md",
    "retrieved_at": "2026-09-06T12:24:48Z",
    "status": "available",
    "url": "https://github.com/wanshuiyin/Auto-claude-code-research-in-sleep.git"
  }
}
