{
  "adapted": {
    "files": [
      {
        "path": "SKILL.md",
        "sha256": "d0cfd4bc59f14c5a503c66ffadc2f0761376bf2f25e20729119eb7a64779effb"
      }
    ],
    "path": "ports/training-health-check/evidence/adapted"
  },
  "baseline": {
    "files": [
      {
        "path": "SKILL.md",
        "sha256": "b912cc10a6227211bdce83c51ed0ba2f6143b108e6b733daaeca809f59588654"
      }
    ],
    "path": "ports/training-health-check/evidence/baseline"
  },
  "contract": {
    "name": "research-os/port",
    "version": "1.0.0"
  },
  "decision": "adapt",
  "decision_evidence": {
    "path": "ports/training-health-check/evidence/decision.json",
    "sha256": "cfe7eec7bad86626fadb923f31efaa783073d19515abd9524607ee79f5749fd1"
  },
  "decision_principal": "person:rolex",
  "evaluation": {
    "adapted": [
      {
        "detail": {
          "path": "ports/training-health-check/evidence/evals/adapted-detail-1.json",
          "sha256": "dc91e09119b9fcd66b0f2f4a1675659c7e2f34680f6cf2126a24b3f8d380b8b5"
        },
        "evidence": {
          "path": "ports/training-health-check/evidence/evals/adapted-1.json",
          "sha256": "200b785aaf06cd20a0113da7a9f63e1093e2e53c2356d8afd21d57c069f87ab3"
        },
        "executed_at": "2026-09-06T12:25:11Z",
        "result": "pass",
        "run_id": "training-health-check-adapted-1",
        "subject_sha256": "58baab817631b84edbd485f9d675816e4593f752f7b50af1a5092a0c3e103bb2"
      },
      {
        "detail": {
          "path": "ports/training-health-check/evidence/evals/adapted-detail-2.json",
          "sha256": "dc91e09119b9fcd66b0f2f4a1675659c7e2f34680f6cf2126a24b3f8d380b8b5"
        },
        "evidence": {
          "path": "ports/training-health-check/evidence/evals/adapted-2.json",
          "sha256": "b86dd9171d6ec9624ceda44be2669c907a43feb33c92679226548527dcd88951"
        },
        "executed_at": "2026-09-06T12:25:12Z",
        "result": "pass",
        "run_id": "training-health-check-adapted-2",
        "subject_sha256": "58baab817631b84edbd485f9d675816e4593f752f7b50af1a5092a0c3e103bb2"
      }
    ],
    "baseline": [
      {
        "detail": {
          "path": "ports/training-health-check/evidence/evals/baseline-detail-1.json",
          "sha256": "55df7e95bac4c447a8db7d45796e6abd1f6b901070bb641c1728ec9644ed32b1"
        },
        "evidence": {
          "path": "ports/training-health-check/evidence/evals/baseline-1.json",
          "sha256": "b63ae31e5faa6aaad736d154b890f92bf4ebf5c23e914cb0dde060dfd4cb4cb0"
        },
        "executed_at": "2026-09-06T12:25:09Z",
        "result": "pass",
        "run_id": "training-health-check-baseline-1",
        "subject_sha256": "4c4e230ed1b2f029addf668c815623199040ed2173bd1e9cdc7e89ae3680893f"
      },
      {
        "detail": {
          "path": "ports/training-health-check/evidence/evals/baseline-detail-2.json",
          "sha256": "55df7e95bac4c447a8db7d45796e6abd1f6b901070bb641c1728ec9644ed32b1"
        },
        "evidence": {
          "path": "ports/training-health-check/evidence/evals/baseline-2.json",
          "sha256": "ae30938230ae1d2374ebeb7d01bb2b47628493d56d5c3591b84a453163a66b90"
        },
        "executed_at": "2026-09-06T12:25:10Z",
        "result": "pass",
        "run_id": "training-health-check-baseline-2",
        "subject_sha256": "4c4e230ed1b2f029addf668c815623199040ed2173bd1e9cdc7e89ae3680893f"
      }
    ],
    "environment": {
      "path": "ports/training-health-check/evidence/environment.txt",
      "sha256": "325a1ffa16ab9dee7534d99125d8407f1a92076e9d1b912ce09303a5a4f2abf8"
    },
    "harness": {
      "path": "ports/training-health-check/evidence/harness.py",
      "sha256": "1417e8eeed9e6d13836a87907492140b38fe619cb0e53e6398c2dd2c3cee64d2"
    }
  },
  "id": "training-health-check",
  "ledger": [
    {
      "action": "modify",
      "path": "SKILL.md",
      "reason": "Retain the research check while adding pinned inputs, bounded verdicts, user-control and no-automation boundaries"
    }
  ],
  "licensing": {
    "license": {
      "path": "ports/training-health-check/evidence/LICENSE",
      "sha256": "e30cf5dd5f49b4f9b656590e23d782b4756c924a9f0ff0162b3e7b5d87006bf5"
    },
    "notice": {
      "reason": "The fixed upstream commit has no root NOTICE file; source attribution and modified-file notice are retained in this manifest and evidence.",
      "status": "not-required"
    },
    "spdx": "MIT",
    "status": "available"
  },
  "origin": "external",
  "original": {
    "behavior": {
      "path": "ports/training-health-check/evidence/original-behavior.md",
      "sha256": "18c3096368d367160e79087f5772db4463b8af17c6f1d4371a64a3e15bddf3a2"
    },
    "dependencies": []
  },
  "product": {
    "path": "ports/products/training-health-check/SKILL.md",
    "sha256": "d0cfd4bc59f14c5a503c66ffadc2f0761376bf2f25e20729119eb7a64779effb"
  },
  "review": {
    "principal": "person:rolex",
    "rationale": "User explicitly approved this fixed source for read-only minimal adaptation. Review recommends only the bounded text discipline under Research OS controls; upstream runtime and commands were not executed.",
    "reviewed_at": "2026-09-06T12:40:00Z"
  },
  "snapshot": {
    "files": [
      {
        "path": "SKILL.md",
        "sha256": "b912cc10a6227211bdce83c51ed0ba2f6143b108e6b733daaeca809f59588654"
      }
    ],
    "path": "ports/training-health-check/evidence/snapshot"
  },
  "source": {
    "commit": "2349f63ccfd7502aae95ec987b4d0a4c65d69c52",
    "evidence": {
      "path": "ports/training-health-check/evidence/source.json",
      "sha256": "d28116169b0eb3040a3cb8715aec420f4fa63cd6ff110a000cd6a061889e1c1c"
    },
    "path": "skills/training-check/SKILL.md",
    "retrieved_at": "2026-09-06T12:24:48Z",
    "status": "available",
    "url": "https://github.com/wanshuiyin/Auto-claude-code-research-in-sleep.git"
  }
}
