{
  "adapted": {
    "files": [
      {
        "path": "SKILL.md",
        "sha256": "6cd3dbaa68b2d617ebc5a3eb9a56d39c7f4356537a7842335bbb046bf33c7ceb"
      }
    ],
    "path": "ports/statistical-check/evidence/adapted"
  },
  "baseline": {
    "files": [
      {
        "path": "SKILL.md",
        "sha256": "2b97b8ae1a279ac8a7db14e7d7bea67934c88352d55c95e20fcfb681a8640930"
      }
    ],
    "path": "ports/statistical-check/evidence/baseline"
  },
  "contract": {
    "name": "research-os/port",
    "version": "1.0.0"
  },
  "decision": "adapt",
  "decision_evidence": {
    "path": "ports/statistical-check/evidence/decision.json",
    "sha256": "0ce449f62f452380a27955f7f224f16d4e1030609d62d16b17882b6152c11c85"
  },
  "decision_principal": "person:rolex",
  "evaluation": {
    "adapted": [
      {
        "detail": {
          "path": "ports/statistical-check/evidence/evals/adapted-detail-1.json",
          "sha256": "10664a0345634728824a6506e339dd0e743f99f29598358044a222fd4feec7a7"
        },
        "evidence": {
          "path": "ports/statistical-check/evidence/evals/adapted-1.json",
          "sha256": "44f90606325ca2676613c7f327ab26eb46fdf04820d5a64e1f15daa8de9a0daf"
        },
        "executed_at": "2026-09-06T12:25:07Z",
        "result": "pass",
        "run_id": "statistical-check-adapted-1",
        "subject_sha256": "754420f6ff2539e992e2410316acd9c43a1a8705d02cf9ee589f3de6db827e11"
      },
      {
        "detail": {
          "path": "ports/statistical-check/evidence/evals/adapted-detail-2.json",
          "sha256": "10664a0345634728824a6506e339dd0e743f99f29598358044a222fd4feec7a7"
        },
        "evidence": {
          "path": "ports/statistical-check/evidence/evals/adapted-2.json",
          "sha256": "52e4bbd1aea72f0e9f9ff04b5a0022109fdbe0cb6e7f0ae3c028a1061762f6cd"
        },
        "executed_at": "2026-09-06T12:25:08Z",
        "result": "pass",
        "run_id": "statistical-check-adapted-2",
        "subject_sha256": "754420f6ff2539e992e2410316acd9c43a1a8705d02cf9ee589f3de6db827e11"
      }
    ],
    "baseline": [
      {
        "detail": {
          "path": "ports/statistical-check/evidence/evals/baseline-detail-1.json",
          "sha256": "9aaaddac7551a64b074782e20fd43843f6410600c9ff0c33dd4302a98b2a2cea"
        },
        "evidence": {
          "path": "ports/statistical-check/evidence/evals/baseline-1.json",
          "sha256": "60b840991810655ca8f5a6103e8ee2312f0465ba4c01174f60e81d4245699141"
        },
        "executed_at": "2026-09-06T12:25:05Z",
        "result": "pass",
        "run_id": "statistical-check-baseline-1",
        "subject_sha256": "f0f4d0aae82895ef00b78474bfdd28fb84a6bdedce4f6fbf8b8cd166f1a0e5bc"
      },
      {
        "detail": {
          "path": "ports/statistical-check/evidence/evals/baseline-detail-2.json",
          "sha256": "9aaaddac7551a64b074782e20fd43843f6410600c9ff0c33dd4302a98b2a2cea"
        },
        "evidence": {
          "path": "ports/statistical-check/evidence/evals/baseline-2.json",
          "sha256": "45a983eeee6b9c1a5eaa2167ade6472435d647000fe201eb2ef5d2bf760e30ee"
        },
        "executed_at": "2026-09-06T12:25:06Z",
        "result": "pass",
        "run_id": "statistical-check-baseline-2",
        "subject_sha256": "f0f4d0aae82895ef00b78474bfdd28fb84a6bdedce4f6fbf8b8cd166f1a0e5bc"
      }
    ],
    "environment": {
      "path": "ports/statistical-check/evidence/environment.txt",
      "sha256": "325a1ffa16ab9dee7534d99125d8407f1a92076e9d1b912ce09303a5a4f2abf8"
    },
    "harness": {
      "path": "ports/statistical-check/evidence/harness.py",
      "sha256": "1417e8eeed9e6d13836a87907492140b38fe619cb0e53e6398c2dd2c3cee64d2"
    }
  },
  "id": "statistical-check",
  "ledger": [
    {
      "action": "modify",
      "path": "SKILL.md",
      "reason": "Retain the research check while adding pinned inputs, bounded verdicts, user-control and no-automation boundaries"
    }
  ],
  "licensing": {
    "license": {
      "path": "ports/statistical-check/evidence/LICENSE",
      "sha256": "e30cf5dd5f49b4f9b656590e23d782b4756c924a9f0ff0162b3e7b5d87006bf5"
    },
    "notice": {
      "reason": "The fixed upstream commit has no root NOTICE file; source attribution and modified-file notice are retained in this manifest and evidence.",
      "status": "not-required"
    },
    "spdx": "MIT",
    "status": "available"
  },
  "origin": "external",
  "original": {
    "behavior": {
      "path": "ports/statistical-check/evidence/original-behavior.md",
      "sha256": "ab4f25fbe7e83b9e570aa7280a3b57d11621687f7fe1c78167bc6a3e4f2fa1d4"
    },
    "dependencies": []
  },
  "product": {
    "path": "ports/products/statistical-check/SKILL.md",
    "sha256": "6cd3dbaa68b2d617ebc5a3eb9a56d39c7f4356537a7842335bbb046bf33c7ceb"
  },
  "review": {
    "principal": "person:rolex",
    "rationale": "User explicitly approved this fixed source for read-only minimal adaptation. Review recommends only the bounded text discipline under Research OS controls; upstream runtime and commands were not executed.",
    "reviewed_at": "2026-09-06T12:40:00Z"
  },
  "snapshot": {
    "files": [
      {
        "path": "SKILL.md",
        "sha256": "2b97b8ae1a279ac8a7db14e7d7bea67934c88352d55c95e20fcfb681a8640930"
      }
    ],
    "path": "ports/statistical-check/evidence/snapshot"
  },
  "source": {
    "commit": "2349f63ccfd7502aae95ec987b4d0a4c65d69c52",
    "evidence": {
      "path": "ports/statistical-check/evidence/source.json",
      "sha256": "96b36923f2fb7d67a01569a49a19da383cb6a3745cbaeb1e92d3ce4f14b6d859"
    },
    "path": "skills/analyze-results/SKILL.md",
    "retrieved_at": "2026-09-06T12:24:48Z",
    "status": "available",
    "url": "https://github.com/wanshuiyin/Auto-claude-code-research-in-sleep.git"
  }
}
