{
  "adapted": {
    "files": [
      {
        "path": "SKILL.md",
        "sha256": "6e83072b8c00a08efd590b407859e8600d64f84b7916edb9f9475df3e68de104"
      }
    ],
    "path": "ports/experiment-audit/evidence/adapted"
  },
  "baseline": {
    "files": [
      {
        "path": "SKILL.md",
        "sha256": "476bde891323ebf9496ac2a52f8dbbf67fae13cfc6f7c69d4d3213794f3f1af2"
      }
    ],
    "path": "ports/experiment-audit/evidence/baseline"
  },
  "contract": {
    "name": "research-os/port",
    "version": "1.0.0"
  },
  "decision": "adapt",
  "decision_evidence": {
    "path": "ports/experiment-audit/evidence/decision.json",
    "sha256": "f2579ab66fbd31e5c54060400d392350e1a12b7dbcf158e685073670a26d4115"
  },
  "decision_principal": "person:rolex",
  "evaluation": {
    "adapted": [
      {
        "detail": {
          "path": "ports/experiment-audit/evidence/evals/adapted-detail-1.json",
          "sha256": "f4effd475192110783768ec0c9e224fc8be94e540c52370ae5c697e24d572b20"
        },
        "evidence": {
          "path": "ports/experiment-audit/evidence/evals/adapted-1.json",
          "sha256": "b5554c9927749339735303b04d4893c03f6651016b8a3141668353dafdab608c"
        },
        "executed_at": "2026-09-06T12:25:03Z",
        "result": "pass",
        "run_id": "experiment-audit-adapted-1",
        "subject_sha256": "fb06927465de1c6c72c1567a50e5363bb98e818af375ede9c651789b00815d40"
      },
      {
        "detail": {
          "path": "ports/experiment-audit/evidence/evals/adapted-detail-2.json",
          "sha256": "f4effd475192110783768ec0c9e224fc8be94e540c52370ae5c697e24d572b20"
        },
        "evidence": {
          "path": "ports/experiment-audit/evidence/evals/adapted-2.json",
          "sha256": "13cd2e6b86ad4537630d6367aa1fd84c0ae1cf0f1ea36da6071c796ca0998c62"
        },
        "executed_at": "2026-09-06T12:25:04Z",
        "result": "pass",
        "run_id": "experiment-audit-adapted-2",
        "subject_sha256": "fb06927465de1c6c72c1567a50e5363bb98e818af375ede9c651789b00815d40"
      }
    ],
    "baseline": [
      {
        "detail": {
          "path": "ports/experiment-audit/evidence/evals/baseline-detail-1.json",
          "sha256": "0f8e589e01f75f287dcfae1671a073d653f9acb53ad231a504bf7b045386ccf0"
        },
        "evidence": {
          "path": "ports/experiment-audit/evidence/evals/baseline-1.json",
          "sha256": "2f616c4c1fe4a1033a8f0a4ec327296fab83292de79ffe77eeadb308100e47bf"
        },
        "executed_at": "2026-09-06T12:25:01Z",
        "result": "pass",
        "run_id": "experiment-audit-baseline-1",
        "subject_sha256": "78097cfe658efc1a7ec8cea4d2f7ea50359eb9bdd2e77ae445015f5f4243a4be"
      },
      {
        "detail": {
          "path": "ports/experiment-audit/evidence/evals/baseline-detail-2.json",
          "sha256": "0f8e589e01f75f287dcfae1671a073d653f9acb53ad231a504bf7b045386ccf0"
        },
        "evidence": {
          "path": "ports/experiment-audit/evidence/evals/baseline-2.json",
          "sha256": "387673eaaed121c0605f75c625f7634113293049032b54c6a3e46131331c67f2"
        },
        "executed_at": "2026-09-06T12:25:02Z",
        "result": "pass",
        "run_id": "experiment-audit-baseline-2",
        "subject_sha256": "78097cfe658efc1a7ec8cea4d2f7ea50359eb9bdd2e77ae445015f5f4243a4be"
      }
    ],
    "environment": {
      "path": "ports/experiment-audit/evidence/environment.txt",
      "sha256": "325a1ffa16ab9dee7534d99125d8407f1a92076e9d1b912ce09303a5a4f2abf8"
    },
    "harness": {
      "path": "ports/experiment-audit/evidence/harness.py",
      "sha256": "1417e8eeed9e6d13836a87907492140b38fe619cb0e53e6398c2dd2c3cee64d2"
    }
  },
  "id": "experiment-audit",
  "ledger": [
    {
      "action": "modify",
      "path": "SKILL.md",
      "reason": "Retain the research check while adding pinned inputs, bounded verdicts, user-control and no-automation boundaries"
    }
  ],
  "licensing": {
    "license": {
      "path": "ports/experiment-audit/evidence/LICENSE",
      "sha256": "e30cf5dd5f49b4f9b656590e23d782b4756c924a9f0ff0162b3e7b5d87006bf5"
    },
    "notice": {
      "reason": "The fixed upstream commit has no root NOTICE file; source attribution and modified-file notice are retained in this manifest and evidence.",
      "status": "not-required"
    },
    "spdx": "MIT",
    "status": "available"
  },
  "origin": "external",
  "original": {
    "behavior": {
      "path": "ports/experiment-audit/evidence/original-behavior.md",
      "sha256": "03b96a8860abbfaaa99b642bde9f320fbac90ad51e84b5a5121a22ed03dbf4a2"
    },
    "dependencies": []
  },
  "product": {
    "path": "ports/products/experiment-audit/SKILL.md",
    "sha256": "6e83072b8c00a08efd590b407859e8600d64f84b7916edb9f9475df3e68de104"
  },
  "review": {
    "principal": "person:rolex",
    "rationale": "User explicitly approved this fixed source for read-only minimal adaptation. Review recommends only the bounded text discipline under Research OS controls; upstream runtime and commands were not executed.",
    "reviewed_at": "2026-09-06T12:40:00Z"
  },
  "snapshot": {
    "files": [
      {
        "path": "SKILL.md",
        "sha256": "476bde891323ebf9496ac2a52f8dbbf67fae13cfc6f7c69d4d3213794f3f1af2"
      }
    ],
    "path": "ports/experiment-audit/evidence/snapshot"
  },
  "source": {
    "commit": "2349f63ccfd7502aae95ec987b4d0a4c65d69c52",
    "evidence": {
      "path": "ports/experiment-audit/evidence/source.json",
      "sha256": "053d816f529f8570466174382b9a2004ee8a9d297ab3c95e3bd52e50222904b9"
    },
    "path": "skills/experiment-audit/SKILL.md",
    "retrieved_at": "2026-09-06T12:24:48Z",
    "status": "available",
    "url": "https://github.com/wanshuiyin/Auto-claude-code-research-in-sleep.git"
  }
}
